{"authorization_ids":["dm:review-authorization:v1:yJXKaPGdW0e5QIoQ854zUysyerlZBDo-tS7otL5t7YQ","dm:review-authorization:v1:zcAiM79qXNPK1rtfJrqYdFI-jzpkLc_nETBaisxnObY"],"candidate":{"author_me_id":"dm:being:v1:W65cs82-KBrSCDxEveY0REOMcInloBgymmOBWFy2KcQ","body_evidence":null,"candidate_id":"dm:memory-candidate:v1:4_zu6F2d5mLBa5ezVUkwunsPEz2FBOZEx9cSgB3xCUA","category":"personal-insight","classification":"protected","consent":"granted","content_ref":{"byte_length":20,"classification":"protected","content_id":"dm:memory-content:v1:PJiNp18iMHJQuJKaVRUgSRmzN_iCuYI3bXZKUnL0hFY","media_type":"text/plain","schema":"dm.memory.content-ref/v1","sha256":"56b1780d47e64dc5f4cbc5f921dc9e4625936efae2d54b0d655d5fb7f4bbca41"},"context":"dm033-vector","contradiction":"none","derivation":"local-synthesis","effect":"local-only","evidence_refs":[],"lane":{"memory_id":"33000000-0000-4000-8000-000000000033","operation":"assert","predecessor_event_id":null,"predecessor_hash":null,"sequence":1},"predecessor_decision_id":null,"safety":"clear","schema":"dm.memory.candidate/v1","subject_me_id":"dm:being:v1:W65cs82-KBrSCDxEveY0REOMcInloBgymmOBWFy2KcQ"},"candidate_hash":"8665b845a5436ee120156fc0bd5da48be923795c95e76a3031694bf8e5d50a48","classification":"protected","consent":"granted","expires_at_ms":1800000060000,"group_id":"dm:review-group:v1:3T0wAZDQ4VJBczRjwSVibwZf90TJDa3ze3Zc93E2kRY","plan":{"candidate_id":"dm:memory-candidate:v1:4_zu6F2d5mLBa5ezVUkwunsPEz2FBOZEx9cSgB3xCUA","checkpoint":{"being_ref":"dm:being:v1:W65cs82-KBrSCDxEveY0REOMcInloBgymmOBWFy2KcQ","body_evidence_state":"absent","captured_at_ms":1800000000000,"evidence_refs":[],"lane_event_ids":[],"lane_head":null,"lane_state":"empty","ledger_state_hash":"380d2cb520ba95f73d5805cd12ad371ad4ca1fbd1e642d43df117ab43736cea0","local_origin":{"body_ref":"cluster:vector:compaii","embodiment_id":"embodiment:vector","incarnation_id":"incarnation:vector:0","principal_id":"compaii@vector"},"manifest_hash":"7bb884a3c012798c740969ed57dd40fd2c42a29a7fd12202e2343b9cc472238b","projection_hash":"c3e8acb30fbbfdbf937ea7591defc66a3134cdb4ec52882030c041d243ddf24a","schema":"dm.memory.checkpoint/v1"},"decision_id":"dm:memory-decision:v1:-qXKzmVnFZBUmJlzi1qC2tb0y2v22HRtseyPhgpFkVA","evaluated_at_ms":1800000000000,"event_preview":{"kind":"memory.recorded","payload":{"author_me_id":"dm:being:v1:W65cs82-KBrSCDxEveY0REOMcInloBgymmOBWFy2KcQ","candidate_id":"dm:memory-candidate:v1:4_zu6F2d5mLBa5ezVUkwunsPEz2FBOZEx9cSgB3xCUA","category":"personal-insight","content_ref":{"byte_length":20,"classification":"protected","content_id":"dm:memory-content:v1:PJiNp18iMHJQuJKaVRUgSRmzN_iCuYI3bXZKUnL0hFY","media_type":"text/plain","schema":"dm.memory.content-ref/v1","sha256":"56b1780d47e64dc5f4cbc5f921dc9e4625936efae2d54b0d655d5fb7f4bbca41"},"context":"dm033-vector","decision_id":"dm:memory-decision:v1:-qXKzmVnFZBUmJlzi1qC2tb0y2v22HRtseyPhgpFkVA","evidence_refs":[],"memory_id":"33000000-0000-4000-8000-000000000033","operation":"assert","policy_id":"dm:memory-policy:v1:JAdmKtYWUGQSQqFr9-hrXf3joul0sQC8ghpZpKNAMXI","predecessor_decision_id":null,"predecessor_event_id":null,"predecessor_hash":null,"schema":"dm.memory.record/v1","sequence":1},"sensitivity":"private","subject":"dm:being:v1:W65cs82-KBrSCDxEveY0REOMcInloBgymmOBWFy2KcQ"},"expires_at_ms":1800000060000,"outcome":"review-required","plan_id":"dm:memory-plan:v1:DHTQDCGzFcQH0QNPKD0L0AAaoj1557Xjvz6t6UW14KY","policy_id":"dm:memory-policy:v1:JAdmKtYWUGQSQqFr9-hrXf3joul0sQC8ghpZpKNAMXI","predecessor_decision_id":null,"reasons":["classification-requires-review"],"schema":"dm.memory.transition-plan/v1","subject_me_id":"dm:being:v1:W65cs82-KBrSCDxEveY0REOMcInloBgymmOBWFy2KcQ"},"plan_hash":"ec81d99636a5dfbd10db1c8bfe341caf3c46472db4aa0bb146ddae4e8af33a58","policy":{"automatic_categories":["personal-insight"],"max_content_bytes":16777216,"plan_ttl_ms":60000,"policy_id":"dm:memory-policy:v1:JAdmKtYWUGQSQqFr9-hrXf3joul0sQC8ghpZpKNAMXI","predecessor_policy_id":null,"review_classifications":["protected"],"schema":"dm.memory.policy/v1","subject_me_id":"dm:being:v1:W65cs82-KBrSCDxEveY0REOMcInloBgymmOBWFy2KcQ","version":1},"policy_hash":"0e4667d92c4bec0f64bfc1319bdea1ed2b8671b5566228e99123b97d8d6a54fb","predecessor_review_request_id":null,"projected_effect_hash":"1f4ad7fb6fb57fc378300ccc54aa87b87e384a075c74592b66d7b70f5f0017d7","proposal":null,"proposal_hash":null,"reasons":["classification-requires-review"],"requested_action":"memory-transition","requested_at_ms":1800000000000,"review_request_id":"dm:review-request:v1:c0WDHbzuYNzHeR_J-Lb7ypqJXAKpVGBKyyMpvwkHgiY","schema":"dm.review.request/v1","subject_me_id":"dm:being:v1:W65cs82-KBrSCDxEveY0REOMcInloBgymmOBWFy2KcQ","threshold":2}
